{
  "date": "2026-11-01",
  "liturgical_day": "Twenty-third Sunday after Pentecost",
  "subtitle_override": null,
  "special": {
    "communion": false,
    "canvass": false
  },
  "pew_bible_page": 398,
  "welcome_variant": "regular",
  "welcome_custom": null,
  "flowers": {
    "given": "in loving memory of our dear friend, Callie Pounders.",
    "message": "Though we miss you more than words can say, we find comfort knowing you are resting in the arms of Jesus. Until we meet again, you will always be remembered, deeply missed, and forever loved.",
    "quote": "“The faithful love of the Lord never ends! His mercies never cease. Great is his faithfulness; his mercies begin afresh each morning.”",
    "reference": "Lamentations 3:22–23",
    "closing": "Forever in our hearts,",
    "signed": "Anna, Ben & Chandler Erwin"
  },
  "announcements": [
    {
      "title": "37th Community Thanksgiving Meal",
      "body": "Join us on Thanksgiving morning, Thursday, November 26, as we prepare and deliver 750 Thanksgiving meals to those who need them throughout Alcorn County. This is a HUGE project and can only be accomplished with the help of many. It is a great opportunity for the members of FPC to be disciples by “living and loving like Jesus.”",
      "print_suffix": "Please complete the insert to volunteer your time and place it in the offering plate, or bring it to the church office.",
      "detail": "To volunteer your time for meal preparation (9:30 a.m.) or delivery (9:45 a.m.), please complete the insert in the printed bulletin and place it in the offering plate, or bring it to the church office."
    },
    {
      "title": "Samaritan’s Purse Shoeboxes",
      "body": "Collection boxes are available in the children’s wing and the side entrance by the church office. You can participate by shopping and collecting items, or by donating monetarily — each shoebox costs $10 to ship. Items needed: small composition notebooks, pencils, small cars/trucks, puzzles, jump ropes, hair bows/barrettes/brushes/combs, underwear in larger sizes, and small stuffed animals. No liquids, candy, or food!"
    },
    {
      "title": "Every Member Canvass",
      "body": "If you haven’t already done so, please complete one of the paper forms available at the Narthex and East entrances, or scan the QR code on the back of the pews."
    }
  ],
  "serve": {
    "assisting_elder": "Dr. John Shipp",
    "greeters": "Courtney & Ivy Monaghan",
    "ushers": "Scott Sawyer, Holland Yeates, Ben Long, & Josh McCahill",
    "acolytes": "Jack Windsor & Will Sanders",
    "nursery": "Laura Kate Carmichiel, Jackie Capps, Morgan Williams, Maribel Albarran, & Joshua & Brittany Bryant",
    "circle_of_prayer": "Jason & Jennifer LeGoff",
    "childrens_church": "Jennifer Shipp",
    "av_engineer": "Russell Smith"
  },
  "staff": null,
  "calendar": [
    { "date": "2026-11-01", "items": ["Session Meeting"] },
    { "date": "2026-11-03", "items": ["Messy Bible Study, 8 a.m.", "Election Day (Fellowship Hall in use)", "No Day School"] },
    { "date": "2026-11-04", "items": ["Kids Quest", "Youth House", "Messy Bible Study, 6 p.m."] },
    { "date": "2026-11-05", "items": ["First Thursday at the Youth House, noon"] },
    { "date": "2026-11-08", "items": ["Deacons’ Meeting"] },
    { "date": "2026-11-26", "items": ["37th Community Thanksgiving Meal"] }
  ],
  "liturgy": {
    "items": [
      { "id": "gathering", "type": "section", "title": "Gathering" },
      { "id": "piano-prelude", "type": "plain", "title": "The Piano Prelude" },
      { "id": "greetings", "type": "plain", "title": "Greetings & Announcements" },
      { "id": "meditation", "type": "scripture", "title": "Call to Meditation", "ref": "Lamentations 3:22–23",
        "text": "“The steadfast love of the Lord never ceases; his mercies never come to an end; they are new every morning; great is your faithfulness.”" },
      { "id": "prelude", "type": "plain", "title": "The Prelude" },
      { "id": "introit", "type": "music", "title": "Choral Introit", "piece": "We Come to Praise" },
      { "id": "call-to-worship", "type": "responsive", "star": true, "title": "Call to Worship", "ref": "Psalm 103:1–2, 20–22 (NIV)",
        "lines": [
          { "who": "Leader", "text": "Praise the Lord, O my soul, all my inmost being, praise his holy name!" },
          { "who": "All", "text": "Praise the Lord, O my soul, and forget not all his benefits," },
          { "who": "Leader", "text": "Praise the Lord, O you his angels, you mighty ones who do his bidding, who obey his word." },
          { "who": "All", "text": "Praise the Lord, all his heavenly hosts, you his servants who do his will!" },
          { "who": "Leader", "text": "Praise the Lord, all his works everywhere in his dominion." },
          { "who": "All", "text": "Praise the Lord, O my soul!" }
        ] },
      { "id": "hymn1", "type": "hymn", "star": true, "title": "The Hymn", "number": 10, "piece": "O Worship the King" },
      { "id": "invocation", "type": "corporate", "star": true, "title": "Prayer of Invocation & The Lord’s Prayer",
        "text": "Our Father, who art in heaven, hallowed be thy Name. Thy Kingdom come, thy will be done on earth, as it is in heaven. Give us this day our daily bread, and forgive us our debts, as we forgive our debtors. Lead us not into temptation, but deliver us from evil. For thine is the kingdom, the power, and the glory, forever. Amen." },
      { "id": "confession-call", "type": "responsive", "star": true, "title": "Scriptural Call to Confession", "ref": "taken from Daniel 9",
        "lines": [
          { "who": "Leader", "text": "I prayed to the Lord my God and made confession, saying, “O Lord, the great and awesome God, who keeps covenant and steadfast love with those who love him and keep his commandments," },
          { "who": "All", "text": "We have sinned and done wrong and acted wickedly and rebelled, turning aside from your commandments and rules." },
          { "who": "Leader", "text": "To you, O Lord, belongs righteousness, but to us open shame, as at this day, to the men of Judah, to the inhabitants of Jerusalem, and to all Israel, those who are near and those who are far away, in all the lands to which you have driven them, because of the treachery that they have committed against you." },
          { "who": "All", "text": "To us, O Lord, belongs open shame, to our kings, to our princes, and to our fathers, because we have sinned against you. To the Lord our God belong mercy and forgiveness, for we have rebelled against him and have not obeyed the voice of the Lord our God by walking in his laws, which he set before us by his servants the prophets." },
          { "who": "Leader", "text": "And now, O Lord our God, who brought your people out of the land of Egypt with a mighty hand, and have made a name for yourself, as at this day, we have sinned, we have done wickedly. Now therefore, O our God, listen to the prayer of your servant and to his pleas for mercy, and for your own sake, O Lord, make your face to shine upon your sanctuary, which is desolate." },
          { "who": "All", "text": "O my God, incline your ear and hear. Open your eyes and see our desolations, and the city that is called by your name. For we do not present our pleas before you because of our righteousness, but because of your great mercy." },
          { "who": "Leader", "text": "O Lord, hear; O Lord, forgive. O Lord, pay attention and act. Delay not, for your own sake, O my God, because your city and your people are called by your name." },
          { "who": "All", "text": "Lord, we have sinned against you, yet you are merciful and forgiving. Hear us as we confess our sins, and restore us according to your steadfast love." }
        ] },
      { "id": "confession", "type": "corporate", "star": true, "title": "Corporate Prayer of Confession", "silent_confession": true,
        "text": "Holy and gracious Father, You are righteous in all Your ways, yet we have sinned against You in thought, word, and deed. We have turned from Your commands, neglected Your Word, and loved our own ways more than Yours. We confess that we have not loved You with our whole hearts or loved our neighbors as ourselves. Forgive us, O Lord, not because of our righteousness, but according to Your great mercy. Restore us by Your grace, renew our hearts, and make us faithful to Your calling, that Your name might be honored among Your people." },
      { "id": "hymn2", "type": "hymn", "star": true, "title": "Hymn of Response", "number": 2, "piece": "Come, Thou Fount of Every Blessing" },
      { "id": "assurance", "type": "scripture", "star": true, "title": "Assurance of Divine Pardon", "ref": "1 John 1:9",
        "text": "“If we confess our sins, he is faithful and just to forgive us our sins and to cleanse us from all unrighteousness.”" },
      { "id": "word", "type": "section", "title": "Word" },
      { "id": "missionary", "type": "speaker", "title": "Monthly Missionary Focus", "name": "Courtney Monaghan", "role": "Missions Committee Member" },
      { "id": "tithes", "type": "plain", "title": "The Giving of Tithes and Offerings" },
      { "id": "anthem", "type": "music", "title": "Choral Anthem", "piece": "That I May Know Thee", "credit": "Elizabeth Beckham" },
      { "id": "doxology", "type": "corporate", "star": true, "title": "The Doxology and Prayer of Dedication",
        "text": "Praise God, from whom all blessings flow; Praise Him, all creatures here below; Praise Him above, ye heavenly host; Praise Father, Son, and Holy Ghost. Amen." },
      { "id": "children", "type": "plain", "star": true, "title": "Children Dismissed to Children’s Church" },
      { "id": "reading", "type": "reading", "title": "Scripture Reading", "ref": "Nehemiah 1:1–11" },
      { "id": "response", "type": "responsive", "title": "Scripture Response", "ref": "Isaiah 40:6b, 8",
        "lines": [